{
  "schemaVersion": 1,
  "kind": "steward.platform-evidence",
  "binding": {
    "commit": "aaaaaaaaaaaaaaaaaaaaaaaaaaaaaaaaaaaaaaaa",
    "sourceFingerprint": "sha256:1111111111111111111111111111111111111111111111111111111111111111",
    "profileFingerprint": "sha256:80cc90512e852ab319d46c2bc09026673e688416c9df5706477223c0274f7c6e",
    "verificationCatalogFingerprint": "sha256:48268b9e7b9aa7c6e7e47d17ae1bf0ecd1cb9235826cabc7e299e8531494fd5c",
    "ciPlanFingerprint": "sha256:9fc39447b52a0b9e85baca6383e93ec3dae28b6dfc28e9fd9c4f25b471bc648d",
    "campaignCatalogFingerprint": "sha256:2222222222222222222222222222222222222222222222222222222222222222",
    "executionSourceFingerprint": "sha256:3333333333333333333333333333333333333333333333333333333333333333"
  },
  "entry": {
    "id": "linux-01-of-02",
    "kind": "platform",
    "platform": "linux",
    "shardIndex": 1,
    "shardCount": 2,
    "caseIds": [
      "core-typecheck",
      "linux-integration"
    ]
  },
  "campaign": {
    "id": "campaign-linux-01-of-02",
    "runtimePlatform": "linux",
    "finalRegressionAttemptId": "attempt-0002-regression"
  },
  "cases": [
    {
      "id": "core-typecheck",
      "round": "regression",
      "status": "PASS",
      "runId": "run-core-typecheck",
      "sourceFingerprintBefore": "sha256:3333333333333333333333333333333333333333333333333333333333333333",
      "sourceFingerprintAfter": "sha256:3333333333333333333333333333333333333333333333333333333333333333",
      "artifactDir": "attempts/attempt-0002-regression/cases/core-typecheck",
      "artifactManifest": {
        "relativePath": "attempts/attempt-0002-regression/cases/core-typecheck/artifact-manifest.json",
        "size": 257,
        "sha256": "sha256:4444444444444444444444444444444444444444444444444444444444444444"
      },
      "evidence": {
        "requiredFiles": [
          "proof.json"
        ],
        "nonEmptyFiles": [
          "proof.json"
        ],
        "missingFiles": [],
        "emptyFiles": [],
        "files": [
          {
            "path": "proof.json",
            "size": 4,
            "sha256": "sha256:9999999999999999999999999999999999999999999999999999999999999999"
          }
        ],
        "secretLikeContent": false
      }
    },
    {
      "id": "linux-integration",
      "round": "regression",
      "status": "PASS",
      "runId": "run-linux-integration",
      "sourceFingerprintBefore": "sha256:3333333333333333333333333333333333333333333333333333333333333333",
      "sourceFingerprintAfter": "sha256:3333333333333333333333333333333333333333333333333333333333333333",
      "artifactDir": "attempts/attempt-0002-regression/cases/linux-integration",
      "artifactManifest": {
        "relativePath": "attempts/attempt-0002-regression/cases/linux-integration/artifact-manifest.json",
        "size": 258,
        "sha256": "sha256:5555555555555555555555555555555555555555555555555555555555555555"
      },
      "evidence": {
        "requiredFiles": [
          "proof.json"
        ],
        "nonEmptyFiles": [
          "proof.json"
        ],
        "missingFiles": [],
        "emptyFiles": [],
        "files": [
          {
            "path": "proof.json",
            "size": 5,
            "sha256": "sha256:aaaaaaaaaaaaaaaaaaaaaaaaaaaaaaaaaaaaaaaaaaaaaaaaaaaaaaaaaaaaaaaa"
          }
        ],
        "secretLikeContent": false
      }
    }
  ],
  "bundleFingerprint": "sha256:0c0150ac4f79e346dbe133c343886b3958f6277a6e1fec66e72979af1d19e19e"
}
